author,comment,commentsCount,pageUrl,replyCount,title,type,videoID,voteCount,source_file,source_text_col,comment_text,comment_text_norm,mode,word_count,has_gender_hint,has_stance_hint,has_experience_hint,has_learning_hint,has_change_hint,has_reinforcement_hint,has_action_hint,has_info_hint,has_identity_hint,keep,keep_reason
@This_is_CKM,Single mothers are much worse than any Dad I can think of...,175,https://www.youtube.com/watch?v=BCDdf4fSpYg,0,Undoing My Father’s Damage - Onyango Otieno (Rix poet),reply,,0,Youtube- Undoing my Father's damage.xlsx,comment,Single mothers are much worse than any Dad I can think of...,single mothers are much worse than any dad i can think of...,v1,12,True,False,True,False,False,False,False,False,False,False,emoji_or_punct_only
@lilianlutomiah7332,Heal,175,https://www.youtube.com/watch?v=BCDdf4fSpYg,0,Undoing My Father’s Damage - Onyango Otieno (Rix poet),reply,,0,Youtube- Undoing my Father's damage.xlsx,comment,Heal,heal,v1,1,False,False,False,False,False,False,False,False,False,False,too_few_words_v1
@afsachesang2238,Touching how can one get to you a friend in that situation,175,https://www.youtube.com/watch?v=BCDdf4fSpYg,0,Undoing My Father’s Damage - Onyango Otieno (Rix poet),comment,,0,Youtube- Undoing my Father's damage.xlsx,comment,Touching how can one get to you a friend in that situation,touching how can one get to you a friend in that situation,v1,12,False,False,True,False,False,False,False,False,False,True,substantive_v1
@lucys702,"Thank you for sharing. ""Your trauma does not define you"" thank you because that reminded me that my past does not define who I am either.",175,https://www.youtube.com/watch?v=BCDdf4fSpYg,0,Undoing My Father’s Damage - Onyango Otieno (Rix poet),comment,,3,Youtube- Undoing my Father's damage.xlsx,comment,"Thank you for sharing. ""Your trauma does not define you"" thank you because that reminded me that my past does not define who I am either.","thank you for sharing. ""your trauma does not define you"" thank you because that reminded me that my past does not define who i am either.",v1,26,False,False,True,False,False,False,False,True,False,False,emoji_or_punct_only
@joycembugua5929,Kudos to those friends who came through for you. They are amazing and blessed,175,https://www.youtube.com/watch?v=BCDdf4fSpYg,0,Undoing My Father’s Damage - Onyango Otieno (Rix poet),comment,,3,Youtube- Undoing my Father's damage.xlsx,comment,Kudos to those friends who came through for you. They are amazing and blessed,kudos to those friends who came through for you. they are amazing and blessed,v1,14,False,False,True,False,False,False,False,False,False,False,emoji_or_punct_only
@omilnetwork,Proud of you.   Thank you.,175,https://www.youtube.com/watch?v=BCDdf4fSpYg,0,Undoing My Father’s Damage - Onyango Otieno (Rix poet),comment,,0,Youtube- Undoing my Father's damage.xlsx,comment,Proud of you.   Thank you.,proud of you. thank you.,v1,5,False,False,False,False,False,False,False,False,False,False,emoji_or_punct_only
@victoriaehrich7131,I bet he never came back to apologize to the poor 10 year old boy. And that's what makes things so hard on the little boy at the time.,175,https://www.youtube.com/watch?v=BCDdf4fSpYg,0,Undoing My Father’s Damage - Onyango Otieno (Rix poet),comment,,2,Youtube- Undoing my Father's damage.xlsx,comment,I bet he never came back to apologize to the poor 10 year old boy. And that's what makes things so hard on the little boy at the time.,i bet he never came back to apologize to the poor 10 year old boy. and that's what makes things so hard on the little boy at the time.,v1,30,True,False,True,False,False,False,False,False,False,False,emoji_or_punct_only
@victoriaehrich7131,Wow!!! This is too touchy.,175,https://www.youtube.com/watch?v=BCDdf4fSpYg,0,Undoing My Father’s Damage - Onyango Otieno (Rix poet),comment,,0,Youtube- Undoing my Father's damage.xlsx,comment,Wow!!! This is too touchy.,wow!!! this is too touchy.,v1,5,False,False,True,False,False,False,False,False,False,False,emoji_or_punct_only
@nafulawafula-gitonga3502,Thank you for your openness and vulnerability Eric. This takes alot of courage and growth.,175,https://www.youtube.com/watch?v=BCDdf4fSpYg,0,Undoing My Father’s Damage - Onyango Otieno (Rix poet),comment,,2,Youtube- Undoing my Father's damage.xlsx,comment,Thank you for your openness and vulnerability Eric. This takes alot of courage and growth.,thank you for your openness and vulnerability eric. this takes alot of courage and growth.,v1,15,False,False,True,False,False,False,False,False,False,False,emoji_or_punct_only
@washingtonodera1523,"Your Dad was a cruel abuser , he must have carried that from his past , don’t hold so much forgive him . Thank him for giving you life , forgive him. Our parents went through so much abuse in form of discipline!!!!",175,https://www.youtube.com/watch?v=BCDdf4fSpYg,0,Undoing My Father’s Damage - Onyango Otieno (Rix poet),comment,,0,Youtube- Undoing my Father's damage.xlsx,comment,"Your Dad was a cruel abuser , he must have carried that from his past , don’t hold so much forgive him . Thank him for giving you life , forgive him. Our parents went through so much abuse in form of discipline!!!!","your dad was a cruel abuser , he must have carried that from his past , don't hold so much forgive him . thank him for giving you life , forgive him. our parents went through so much abuse in form of discipline!!!!",v1,40,False,False,True,False,False,False,True,False,False,False,emoji_or_punct_only
@monicakay8973,"I've listened/watched your story before, I think on Legally Clueless (Not sure). It's as educative today as the first time I listened. As a mum it teaches me:

1. I need to overcome my own traumas.
2. I need to practice intentional parenting especially listening to my child.

May you keep healing and recovering emotionally.",175,https://www.youtube.com/watch?v=BCDdf4fSpYg,1,Undoing My Father’s Damage - Onyango Otieno (Rix poet),comment,,14,Youtube- Undoing my Father's damage.xlsx,comment,"I've listened/watched your story before, I think on Legally Clueless (Not sure). It's as educative today as the first time I listened. As a mum it teaches me:

1. I need to overcome my own traumas.
2. I need to practice intentional parenting especially listening to my child.

May you keep healing and recovering emotionally.","i've listened/watched your story before, i think on legally clueless (not sure). it's as educative today as the first time i listened. as a mum it teaches me: 1. i need to overcome my own traumas. 2. i need to practice intentional parenting especially listening to my child. may you keep healing and recovering emotionally.",v1,58,False,False,True,False,False,False,True,False,False,False,emoji_or_punct_only
@TinnahAchy,This has made me cry 😢 haki. What an animal kind of dad....,175,https://www.youtube.com/watch?v=BCDdf4fSpYg,0,Undoing My Father’s Damage - Onyango Otieno (Rix poet),comment,,0,Youtube- Undoing my Father's damage.xlsx,comment,This has made me cry 😢 haki. What an animal kind of dad....,this has made me cry 😢 haki. what an animal kind of dad....,v1,12,False,False,True,False,False,False,False,False,False,False,emoji_or_punct_only
@Js82able,Much hugs on your healing journey,175,https://www.youtube.com/watch?v=BCDdf4fSpYg,0,Undoing My Father’s Damage - Onyango Otieno (Rix poet),comment,,0,Youtube- Undoing my Father's damage.xlsx,comment,Much hugs on your healing journey,much hugs on your healing journey,v1,6,False,False,True,False,False,False,False,False,False,True,substantive_v1
@nabululeuria1891,"Rix, your boldness to actually heal from all this 🥺❤",175,https://www.youtube.com/watch?v=BCDdf4fSpYg,0,Undoing My Father’s Damage - Onyango Otieno (Rix poet),comment,,2,Youtube- Undoing my Father's damage.xlsx,comment,"Rix, your boldness to actually heal from all this 🥺❤","rix, your boldness to actually heal from all this 🥺❤",v1,9,False,False,True,False,False,False,False,True,False,False,emoji_or_punct_only
@kelgk2086,… something had broken…that took me.,175,https://www.youtube.com/watch?v=BCDdf4fSpYg,0,Undoing My Father’s Damage - Onyango Otieno (Rix poet),comment,,1,Youtube- Undoing my Father's damage.xlsx,comment,… something had broken…that took me.,… something had broken…that took me.,v1,6,False,False,True,False,False,False,False,False,False,False,emoji_or_punct_only
@Honest_Man,Why is it that it's Mostly women relate with this,175,https://www.youtube.com/watch?v=BCDdf4fSpYg,0,Undoing My Father’s Damage - Onyango Otieno (Rix poet),comment,,3,Youtube- Undoing my Father's damage.xlsx,comment,Why is it that it's Mostly women relate with this,why is it that it's mostly women relate with this,v1,11,True,False,True,False,False,False,False,False,False,False,emoji_or_punct_only
@ireneabuya7231,"Most of us our childhood was crazy but yours was crazier bro,i pray that you heal fully ,so sorry for what you went thru",175,https://www.youtube.com/watch?v=BCDdf4fSpYg,0,Undoing My Father’s Damage - Onyango Otieno (Rix poet),comment,,0,Youtube- Undoing my Father's damage.xlsx,comment,"Most of us our childhood was crazy but yours was crazier bro,i pray that you heal fully ,so sorry for what you went thru","most of us our childhood was crazy but yours was crazier bro,i pray that you heal fully ,so sorry for what you went thru",v1,25,False,False,True,False,False,False,False,False,False,False,emoji_or_punct_only
@FavouredBCOD12,Great life story to learn from....Thanks for enlightening many.....Lots of love..Hopefully we'll meet up!,175,https://www.youtube.com/watch?v=BCDdf4fSpYg,0,Undoing My Father’s Damage - Onyango Otieno (Rix poet),comment,,1,Youtube- Undoing my Father's damage.xlsx,comment,Great life story to learn from....Thanks for enlightening many.....Lots of love..Hopefully we'll meet up!,great life story to learn from....thanks for enlightening many.....lots of love..hopefully we'll meet up!,v1,18,True,False,True,True,False,False,False,False,False,False,emoji_or_punct_only
@carpediem1569,I read a book called purple hibiscus by chimamanda the other day and in it there was a similar scene only that it was the feet that got burnt and I thought that that must be fictional. That it can only happen in novels.  That no parent can put their kid through that. And now I'm listening to you and the book came to life. I'm so sorry that happened to you. I'm so happy that you've taken charge of your life  and cut out that toxic parent. There's a reason you're alive today and you will touch and  change more lives than you could ever imagine.  Lots of love and virtual hugs.,175,https://www.youtube.com/watch?v=BCDdf4fSpYg,1,Undoing My Father’s Damage - Onyango Otieno (Rix poet),comment,,11,Youtube- Undoing my Father's damage.xlsx,comment,I read a book called purple hibiscus by chimamanda the other day and in it there was a similar scene only that it was the feet that got burnt and I thought that that must be fictional. That it can only happen in novels.  That no parent can put their kid through that. And now I'm listening to you and the book came to life. I'm so sorry that happened to you. I'm so happy that you've taken charge of your life  and cut out that toxic parent. There's a reason you're alive today and you will touch and  change more lives than you could ever imagine.  Lots of love and virtual hugs.,i read a book called purple hibiscus by chimamanda the other day and in it there was a similar scene only that it was the feet that got burnt and i thought that that must be fictional. that it can only happen in novels. that no parent can put their kid through that. and now i'm listening to you and the book came to life. i'm so sorry that happened to you. i'm so happy that you've taken charge of your life and cut out that toxic parent. there's a reason you're alive today and you will touch and change more lives than you could ever imagine. lots of love and virtual hugs.,v1,119,True,False,True,False,False,False,True,False,False,False,emoji_or_punct_only
@tabithamarami8133,Ati? Your mum was watching helplessly? Your uncle? No one could stop this madman from this abuse? Lord have mercy...,175,https://www.youtube.com/watch?v=BCDdf4fSpYg,0,Undoing My Father’s Damage - Onyango Otieno (Rix poet),comment,,1,Youtube- Undoing my Father's damage.xlsx,comment,Ati? Your mum was watching helplessly? Your uncle? No one could stop this madman from this abuse? Lord have mercy...,ati? your mum was watching helplessly? your uncle? no one could stop this madman from this abuse? lord have mercy...,v1,20,True,False,True,False,False,False,True,False,False,False,emoji_or_punct_only
@gracenjamba1792,My God you are telling my story.I went through this……,175,https://www.youtube.com/watch?v=BCDdf4fSpYg,0,Undoing My Father’s Damage - Onyango Otieno (Rix poet),comment,,1,Youtube- Undoing my Father's damage.xlsx,comment,My God you are telling my story.I went through this……,my god you are telling my story.i went through this……,v1,11,False,False,True,False,False,False,False,False,False,False,emoji_or_punct_only
@daringdarling6892,Thank you Onyango for sharing this heartbreaking and  power full story. I hope it inspires us all to embark on our journey to heal our traumas🙏,175,https://www.youtube.com/watch?v=BCDdf4fSpYg,0,Undoing My Father’s Damage - Onyango Otieno (Rix poet),comment,,0,Youtube- Undoing my Father's damage.xlsx,comment,Thank you Onyango for sharing this heartbreaking and  power full story. I hope it inspires us all to embark on our journey to heal our traumas🙏,thank you onyango for sharing this heartbreaking and power full story. i hope it inspires us all to embark on our journey to heal our traumas🙏,v1,26,False,False,True,False,False,False,False,False,False,False,emoji_or_punct_only
@Foi_Wanyeki,"Sending healing, love and light your way Chris💕",175,https://www.youtube.com/watch?v=BCDdf4fSpYg,0,Undoing My Father’s Damage - Onyango Otieno (Rix poet),reply,,0,Youtube- Undoing my Father's damage.xlsx,comment,"Sending healing, love and light your way Chris💕","sending healing, love and light your way chris💕",v1,8,False,False,True,False,False,False,False,False,False,False,emoji_or_punct_only
@FelixAijah,How is your relationship with your mum upto now man. I went through similar experiences.,175,https://www.youtube.com/watch?v=BCDdf4fSpYg,0,Undoing My Father’s Damage - Onyango Otieno (Rix poet),reply,,0,Youtube- Undoing my Father's damage.xlsx,comment,How is your relationship with your mum upto now man. I went through similar experiences.,how is your relationship with your mum upto now man. i went through similar experiences.,v1,15,True,False,True,False,False,False,False,False,False,False,emoji_or_punct_only
@This_is_CKM,Single mothers are horrible,175,https://www.youtube.com/watch?v=BCDdf4fSpYg,0,Undoing My Father’s Damage - Onyango Otieno (Rix poet),reply,,0,Youtube- Undoing my Father's damage.xlsx,comment,Single mothers are horrible,single mothers are horrible,v1,4,True,False,True,False,False,False,False,False,False,True,substantive_v1
@EngageTalk,"Yes, we need to recognise and heal our own traumas so that we can live full lives and raise wholesome children.",175,https://www.youtube.com/watch?v=BCDdf4fSpYg,0,Undoing My Father’s Damage - Onyango Otieno (Rix poet),reply,,1,Youtube- Undoing my Father's damage.xlsx,comment,"Yes, we need to recognise and heal our own traumas so that we can live full lives and raise wholesome children.","yes, we need to recognise and heal our own traumas so that we can live full lives and raise wholesome children.",v1,21,False,False,True,False,False,False,True,False,False,False,emoji_or_punct_only
@aminaaminata6268,RIX you are a legend. Keep inspiring us. Cb made me want to follow him for a minute. Waah! Story for another day.,175,https://www.youtube.com/watch?v=BCDdf4fSpYg,1,Undoing My Father’s Damage - Onyango Otieno (Rix poet),comment,,1,Youtube- Undoing my Father's damage.xlsx,comment,RIX you are a legend. Keep inspiring us. Cb made me want to follow him for a minute. Waah! Story for another day.,rix you are a legend. keep inspiring us. cb made me want to follow him for a minute. waah! story for another day.,v1,23,False,False,True,False,False,False,False,False,False,False,emoji_or_punct_only
@BG-gt1xy,Have you forgiven your father  ?,175,https://www.youtube.com/watch?v=BCDdf4fSpYg,0,Undoing My Father’s Damage - Onyango Otieno (Rix poet),comment,,0,Youtube- Undoing my Father's damage.xlsx,comment,Have you forgiven your father  ?,have you forgiven your father ?,v1,5,True,False,True,False,False,False,False,False,False,False,emoji_or_punct_only
@ireneobonyo5465,This was a painful one to listen to because I have seen it. I'm glad you overcame.,175,https://www.youtube.com/watch?v=BCDdf4fSpYg,0,Undoing My Father’s Damage - Onyango Otieno (Rix poet),comment,,0,Youtube- Undoing my Father's damage.xlsx,comment,This was a painful one to listen to because I have seen it. I'm glad you overcame.,this was a painful one to listen to because i have seen it. i'm glad you overcame.,v1,18,False,False,True,False,False,False,False,True,False,False,emoji_or_punct_only
@winskitchen.602,"This story has reminded me how Michael Jackson dad mistreated them and the kids got stressed ,sometimes  we as parents needs to rethink before we punish our kids,who said,lazima punishment be beaten,?",175,https://www.youtube.com/watch?v=BCDdf4fSpYg,0,Undoing My Father’s Damage - Onyango Otieno (Rix poet),comment,,1,Youtube- Undoing my Father's damage.xlsx,comment,"This story has reminded me how Michael Jackson dad mistreated them and the kids got stressed ,sometimes  we as parents needs to rethink before we punish our kids,who said,lazima punishment be beaten,?","this story has reminded me how michael jackson dad mistreated them and the kids got stressed ,sometimes we as parents needs to rethink before we punish our kids,who said,lazima punishment be beaten,?",v1,34,True,False,True,False,False,False,False,False,False,False,emoji_or_punct_only
@angelbell716,Thanks for sharing your story 😊.  You just expressed what I have been going through without having the strength and words that you have. Thanks again  God bless you for your bravery 🙏🙏,175,https://www.youtube.com/watch?v=BCDdf4fSpYg,1,Undoing My Father’s Damage - Onyango Otieno (Rix poet),comment,,1,Youtube- Undoing my Father's damage.xlsx,comment,Thanks for sharing your story 😊.  You just expressed what I have been going through without having the strength and words that you have. Thanks again  God bless you for your bravery 🙏🙏,thanks for sharing your story 😊. you just expressed what i have been going through without having the strength and words that you have. thanks again god bless you for your bravery 🙏🙏,v1,31,False,False,True,False,False,False,False,False,False,False,emoji_or_punct_only
@thediaryofaneasymommylife4046,"Toxic parents, childhood trauma, unstable marriage. Am glad blacks are starting to recognize what pain did to them. Talking about what the parents did, thats strength!!",175,https://www.youtube.com/watch?v=BCDdf4fSpYg,0,Undoing My Father’s Damage - Onyango Otieno (Rix poet),comment,,4,Youtube- Undoing my Father's damage.xlsx,comment,"Toxic parents, childhood trauma, unstable marriage. Am glad blacks are starting to recognize what pain did to them. Talking about what the parents did, thats strength!!","toxic parents, childhood trauma, unstable marriage. am glad blacks are starting to recognize what pain did to them. talking about what the parents did, thats strength!!",v1,26,False,False,True,False,False,False,True,False,False,False,emoji_or_punct_only
@erastusmuya7208,same boat..really eye opening,175,https://www.youtube.com/watch?v=BCDdf4fSpYg,0,Undoing My Father’s Damage - Onyango Otieno (Rix poet),comment,,0,Youtube- Undoing my Father's damage.xlsx,comment,same boat..really eye opening,same boat..really eye opening,v1,5,False,False,True,False,False,False,False,False,False,False,emoji_or_punct_only
@nmnteamdknn8405,Nooooooo. That's very cruel... just for a book????why didn't you mom intervene??? GOOD lord....,175,https://www.youtube.com/watch?v=BCDdf4fSpYg,0,Undoing My Father’s Damage - Onyango Otieno (Rix poet),comment,,0,Youtube- Undoing my Father's damage.xlsx,comment,Nooooooo. That's very cruel... just for a book????why didn't you mom intervene??? GOOD lord....,nooooooo. that's very cruel... just for a book????why didn't you mom intervene??? good lord....,v1,17,False,False,True,False,False,False,False,False,False,False,emoji_or_punct_only
@ednamuhanji,This is painful. Unbelievable. And your mum did nothing? 10 years old? You were so young. Needed protection.,175,https://www.youtube.com/watch?v=BCDdf4fSpYg,2,Undoing My Father’s Damage - Onyango Otieno (Rix poet),comment,,0,Youtube- Undoing my Father's damage.xlsx,comment,This is painful. Unbelievable. And your mum did nothing? 10 years old? You were so young. Needed protection.,this is painful. unbelievable. and your mum did nothing? 10 years old? you were so young. needed protection.,v1,18,False,False,True,False,False,False,True,False,False,False,emoji_or_punct_only
@L-ameck,"This was amazing. Although you have not talked much about why your dad was sweet and bitter at the same time, I can see some traits of a narcissist from the way you describe his behavior. Having or growing up in a narcissistic environment can be very toxic for any child. I am close to one who was brought up and the mental disorder she has to fix at an old age is not worth it. It's devastating and draining. I hope you find peace.",175,https://www.youtube.com/watch?v=BCDdf4fSpYg,0,Undoing My Father’s Damage - Onyango Otieno (Rix poet),comment,,1,Youtube- Undoing my Father's damage.xlsx,comment,"This was amazing. Although you have not talked much about why your dad was sweet and bitter at the same time, I can see some traits of a narcissist from the way you describe his behavior. Having or growing up in a narcissistic environment can be very toxic for any child. I am close to one who was brought up and the mental disorder she has to fix at an old age is not worth it. It's devastating and draining. I hope you find peace.","this was amazing. although you have not talked much about why your dad was sweet and bitter at the same time, i can see some traits of a narcissist from the way you describe his behavior. having or growing up in a narcissistic environment can be very toxic for any child. i am close to one who was brought up and the mental disorder she has to fix at an old age is not worth it. it's devastating and draining. i hope you find peace.",v1,86,True,False,True,False,False,False,False,False,False,False,emoji_or_punct_only
@Thespokenfor,"Childhood traumas  are real, especially where toxic parents are concerned. 
Like you, when I  learned to recognize  and name my pain ,healing began. God above all.",175,https://www.youtube.com/watch?v=BCDdf4fSpYg,1,Undoing My Father’s Damage - Onyango Otieno (Rix poet),comment,,7,Youtube- Undoing my Father's damage.xlsx,comment,"Childhood traumas  are real, especially where toxic parents are concerned. 
Like you, when I  learned to recognize  and name my pain ,healing began. God above all.","childhood traumas are real, especially where toxic parents are concerned. like you, when i learned to recognize and name my pain ,healing began. god above all.",v1,26,False,False,True,True,False,False,False,False,False,False,emoji_or_punct_only
@Mildred-98,"Hugs and thank you for sharing this part of your life, sounds familiar but we are writing better stories for our children to tell...",175,https://www.youtube.com/watch?v=BCDdf4fSpYg,1,Undoing My Father’s Damage - Onyango Otieno (Rix poet),comment,,2,Youtube- Undoing my Father's damage.xlsx,comment,"Hugs and thank you for sharing this part of your life, sounds familiar but we are writing better stories for our children to tell...","hugs and thank you for sharing this part of your life, sounds familiar but we are writing better stories for our children to tell...",v1,24,False,False,True,False,False,False,False,False,False,False,emoji_or_punct_only
@akinyiokeyo4618,Feeling the fear and beyond....asante.,175,https://www.youtube.com/watch?v=BCDdf4fSpYg,0,Undoing My Father’s Damage - Onyango Otieno (Rix poet),comment,,1,Youtube- Undoing my Father's damage.xlsx,comment,Feeling the fear and beyond....asante.,feeling the fear and beyond....asante.,v1,6,False,False,True,False,False,False,False,False,False,False,emoji_or_punct_only
@listanthenya5392,This is so painful to listen to! It's unfathomable! May you find healing!,175,https://www.youtube.com/watch?v=BCDdf4fSpYg,0,Undoing My Father’s Damage - Onyango Otieno (Rix poet),comment,,2,Youtube- Undoing my Father's damage.xlsx,comment,This is so painful to listen to! It's unfathomable! May you find healing!,this is so painful to listen to! it's unfathomable! may you find healing!,v1,14,False,False,True,False,False,False,False,False,False,False,emoji_or_punct_only
@bellaolum9515,"I watched your story somewhere I think in Justus' channel, it was quite chilling. Thank God you are healing.",175,https://www.youtube.com/watch?v=BCDdf4fSpYg,0,Undoing My Father’s Damage - Onyango Otieno (Rix poet),comment,,2,Youtube- Undoing my Father's damage.xlsx,comment,"I watched your story somewhere I think in Justus' channel, it was quite chilling. Thank God you are healing.","i watched your story somewhere i think in justus' channel, it was quite chilling. thank god you are healing.",v1,19,False,False,True,False,False,False,False,False,False,False,emoji_or_punct_only
