author,comment,commentsCount,pageUrl,replyCount,title,type,videoID,voteCount,source_file,source_text_col,comment_text,comment_text_norm,mode,word_count,has_gender_hint,has_stance_hint,has_experience_hint,has_learning_hint,has_change_hint,has_reinforcement_hint,has_action_hint,has_info_hint,has_identity_hint,keep,keep_reason
@marygithui7958,"I wasn't prepared for this.
Damn.
I am sorry for having to experience this,as a child.",175,https://www.youtube.com/watch?v=BCDdf4fSpYg,0,Undoing My Father’s Damage - Onyango Otieno (Rix poet),comment,,0,Youtube- Undoing my Father's damage.xlsx,comment,"I wasn't prepared for this.
Damn.
I am sorry for having to experience this,as a child.","i wasn't prepared for this. damn. i am sorry for having to experience this,as a child.",v1,18,False,False,True,False,False,False,False,False,False,False,emoji_or_punct_only
@pamelaotieno857,I can't stop crying. What a parent!,175,https://www.youtube.com/watch?v=BCDdf4fSpYg,0,Undoing My Father’s Damage - Onyango Otieno (Rix poet),comment,,0,Youtube- Undoing my Father's damage.xlsx,comment,I can't stop crying. What a parent!,i can't stop crying. what a parent!,v1,8,False,False,True,False,False,False,True,False,False,False,emoji_or_punct_only
@jacksonogandoh9637,"From your story it looks like you were also a bad child, don't blame it on your dad 100%",175,https://www.youtube.com/watch?v=BCDdf4fSpYg,0,Undoing My Father’s Damage - Onyango Otieno (Rix poet),comment,,0,Youtube- Undoing my Father's damage.xlsx,comment,"From your story it looks like you were also a bad child, don't blame it on your dad 100%","from your story it looks like you were also a bad child, don't blame it on your dad 100%",v1,20,False,False,True,False,False,False,False,False,False,False,emoji_or_punct_only
@wawanjohi,"There's a layer of sadness in his face and voice even after dealing with all that trauma intentionally through therapy. And to think that he stood a chance to have a totally different life if the parents did a good job raising him 😢 is sad. 

It is evident that parents indeed shape their kid's lives.",175,https://www.youtube.com/watch?v=BCDdf4fSpYg,0,Undoing My Father’s Damage - Onyango Otieno (Rix poet),comment,,2,Youtube- Undoing my Father's damage.xlsx,comment,"There's a layer of sadness in his face and voice even after dealing with all that trauma intentionally through therapy. And to think that he stood a chance to have a totally different life if the parents did a good job raising him 😢 is sad. 

It is evident that parents indeed shape their kid's lives.",there's a layer of sadness in his face and voice even after dealing with all that trauma intentionally through therapy. and to think that he stood a chance to have a totally different life if the parents did a good job raising him 😢 is sad. it is evident that parents indeed shape their kid's lives.,v1,57,False,False,True,False,False,False,False,False,False,False,emoji_or_punct_only
@muthoniblessed155,Your dad should go straight to jail..😢 may he face hell alive😮,175,https://www.youtube.com/watch?v=BCDdf4fSpYg,0,Undoing My Father’s Damage - Onyango Otieno (Rix poet),comment,,0,Youtube- Undoing my Father's damage.xlsx,comment,Your dad should go straight to jail..😢 may he face hell alive😮,your dad should go straight to jail..😢 may he face hell alive😮,v1,12,False,False,True,False,False,False,True,False,False,False,emoji_or_punct_only
@myterrynYT,Weeee....,175,https://www.youtube.com/watch?v=BCDdf4fSpYg,0,Undoing My Father’s Damage - Onyango Otieno (Rix poet),comment,,0,Youtube- Undoing my Father's damage.xlsx,comment,Weeee....,weeee....,v1,1,False,False,False,False,False,False,False,False,False,False,emoji_or_punct_only
@JoanMaina-l3t,"This has touched my heart. As he was telling the story, I was visualising and I have felt his pain. This is one of the best stories I have heard. Thank you for sharing it ❤",175,https://www.youtube.com/watch?v=BCDdf4fSpYg,0,Undoing My Father’s Damage - Onyango Otieno (Rix poet),comment,,0,Youtube- Undoing my Father's damage.xlsx,comment,"This has touched my heart. As he was telling the story, I was visualising and I have felt his pain. This is one of the best stories I have heard. Thank you for sharing it ❤","this has touched my heart. as he was telling the story, i was visualising and i have felt his pain. this is one of the best stories i have heard. thank you for sharing it ❤",v1,35,False,False,True,False,False,False,False,False,False,False,emoji_or_punct_only
@Lillyanne26,People hate single mothers but this is the typical home with dads😢😮,175,https://www.youtube.com/watch?v=BCDdf4fSpYg,2,Undoing My Father’s Damage - Onyango Otieno (Rix poet),comment,,6,Youtube- Undoing my Father's damage.xlsx,comment,People hate single mothers but this is the typical home with dads😢😮,people hate single mothers but this is the typical home with dads😢😮,v1,12,True,False,True,False,False,False,False,False,False,False,emoji_or_punct_only
@MicClay-u3v,In afrika we talk about our dads with nostalgia. I cry for genz they can and will never understand this a father's love,175,https://www.youtube.com/watch?v=BCDdf4fSpYg,0,Undoing My Father’s Damage - Onyango Otieno (Rix poet),comment,,0,Youtube- Undoing my Father's damage.xlsx,comment,In afrika we talk about our dads with nostalgia. I cry for genz they can and will never understand this a father's love,in afrika we talk about our dads with nostalgia. i cry for genz they can and will never understand this a father's love,v1,24,True,False,True,False,False,False,False,False,False,False,emoji_or_punct_only
@kevinmutai6902,"You are strong..sir..ready to fly higher,.Supreme being would guide you..",175,https://www.youtube.com/watch?v=BCDdf4fSpYg,0,Undoing My Father’s Damage - Onyango Otieno (Rix poet),comment,,0,Youtube- Undoing my Father's damage.xlsx,comment,"You are strong..sir..ready to fly higher,.Supreme being would guide you..","you are strong..sir..ready to fly higher,.supreme being would guide you..",v1,13,False,False,True,False,False,False,False,False,False,False,emoji_or_punct_only
@janewerikhe9528,And your mom couldn't protect you?,175,https://www.youtube.com/watch?v=BCDdf4fSpYg,1,Undoing My Father’s Damage - Onyango Otieno (Rix poet),comment,,1,Youtube- Undoing my Father's damage.xlsx,comment,And your mom couldn't protect you?,and your mom couldn't protect you?,v1,7,False,False,False,False,False,False,True,False,False,False,emoji_or_punct_only
@janewerikhe9528,Oh dear,175,https://www.youtube.com/watch?v=BCDdf4fSpYg,0,Undoing My Father’s Damage - Onyango Otieno (Rix poet),comment,,0,Youtube- Undoing my Father's damage.xlsx,comment,Oh dear,oh dear,v1,2,False,False,False,False,False,False,False,False,False,False,too_few_words_v1
@benedictkipkemoi-kd5tg,Sorry bro. This is too much,175,https://www.youtube.com/watch?v=BCDdf4fSpYg,0,Undoing My Father’s Damage - Onyango Otieno (Rix poet),comment,,0,Youtube- Undoing my Father's damage.xlsx,comment,Sorry bro. This is too much,sorry bro. this is too much,v1,6,False,False,True,False,False,False,False,False,False,False,emoji_or_punct_only
@aswanb.omondi7669,Great speech. Mental illness is real,175,https://www.youtube.com/watch?v=BCDdf4fSpYg,0,Undoing My Father’s Damage - Onyango Otieno (Rix poet),comment,,0,Youtube- Undoing my Father's damage.xlsx,comment,Great speech. Mental illness is real,great speech. mental illness is real,v1,6,True,False,True,False,False,False,False,False,False,False,emoji_or_punct_only
@chrismeshack9423,"Thats just me. I've forgiven my Dad, he's quite old now, but we can't have a father-son relationship. I'm still building on that. Pole ndugu.",175,https://www.youtube.com/watch?v=BCDdf4fSpYg,1,Undoing My Father’s Damage - Onyango Otieno (Rix poet),comment,,0,Youtube- Undoing my Father's damage.xlsx,comment,"Thats just me. I've forgiven my Dad, he's quite old now, but we can't have a father-son relationship. I'm still building on that. Pole ndugu.","thats just me. i've forgiven my dad, he's quite old now, but we can't have a father-son relationship. i'm still building on that. pole ndugu.",v1,30,True,False,True,False,False,False,False,False,False,False,emoji_or_punct_only
@averagejoeke,"YOU STEAL YOUR DAD'S ATM AND WHEN HE GIVES YOU AN ASS WHOOPING YOU CALL THAT TRAUMA? BRO, YOU JUST WANT TO BE A VICTIM OF ANYTHING AROUND YOU...YOUR DAD, YOUR MIND ETC.. YOU DONT KNOW A THING ABOUT TRAUMA!",175,https://www.youtube.com/watch?v=BCDdf4fSpYg,0,Undoing My Father’s Damage - Onyango Otieno (Rix poet),comment,,0,Youtube- Undoing my Father's damage.xlsx,comment,"YOU STEAL YOUR DAD'S ATM AND WHEN HE GIVES YOU AN ASS WHOOPING YOU CALL THAT TRAUMA? BRO, YOU JUST WANT TO BE A VICTIM OF ANYTHING AROUND YOU...YOUR DAD, YOUR MIND ETC.. YOU DONT KNOW A THING ABOUT TRAUMA!","you steal your dad's atm and when he gives you an ass whooping you call that trauma? bro, you just want to be a victim of anything around you...your dad, your mind etc.. you dont know a thing about trauma!",v1,42,False,False,True,False,False,False,False,False,False,False,emoji_or_punct_only
@laureenamondi6913,Go champ you are a wonderful person🎉,175,https://www.youtube.com/watch?v=BCDdf4fSpYg,0,Undoing My Father’s Damage - Onyango Otieno (Rix poet),comment,,0,Youtube- Undoing my Father's damage.xlsx,comment,Go champ you are a wonderful person🎉,go champ you are a wonderful person🎉,v1,7,False,False,False,False,False,False,False,False,False,False,emoji_or_punct_only
@Wakilispeare,Beautiful 💕💐👌🏽,175,https://www.youtube.com/watch?v=BCDdf4fSpYg,0,Undoing My Father’s Damage - Onyango Otieno (Rix poet),comment,,0,Youtube- Undoing my Father's damage.xlsx,comment,Beautiful 💕💐👌🏽,beautiful 💕💐👌🏽,v1,1,False,False,True,False,False,False,False,False,False,False,emoji_or_punct_only
@GeekyGumbots,Poor kid,175,https://www.youtube.com/watch?v=BCDdf4fSpYg,0,Undoing My Father’s Damage - Onyango Otieno (Rix poet),comment,,0,Youtube- Undoing my Father's damage.xlsx,comment,Poor kid,poor kid,v1,2,False,False,True,False,False,False,False,False,False,False,too_few_words_v1
@kirowompeter1706,Pathetic indeed,175,https://www.youtube.com/watch?v=BCDdf4fSpYg,0,Undoing My Father’s Damage - Onyango Otieno (Rix poet),comment,,0,Youtube- Undoing my Father's damage.xlsx,comment,Pathetic indeed,pathetic indeed,v1,2,False,False,True,False,False,False,False,False,False,False,too_few_words_v1
@Lillyanne26,Pia her she was a victim of the monster 😮,175,https://www.youtube.com/watch?v=BCDdf4fSpYg,0,Undoing My Father’s Damage - Onyango Otieno (Rix poet),reply,,0,Youtube- Undoing my Father's damage.xlsx,comment,Pia her she was a victim of the monster 😮,pia her she was a victim of the monster 😮,v1,9,False,False,True,False,False,False,False,False,False,False,emoji_or_punct_only
@janetadhiambo7721,Hugs 🫂,175,https://www.youtube.com/watch?v=BCDdf4fSpYg,0,Undoing My Father’s Damage - Onyango Otieno (Rix poet),reply,,0,Youtube- Undoing my Father's damage.xlsx,comment,Hugs 🫂,hugs 🫂,v1,1,False,False,False,False,False,False,False,False,False,False,emoji_or_punct_only
@estherkuria3170,I can't finish listening to this 😥,175,https://www.youtube.com/watch?v=BCDdf4fSpYg,0,Undoing My Father’s Damage - Onyango Otieno (Rix poet),comment,,0,Youtube- Undoing my Father's damage.xlsx,comment,I can't finish listening to this 😥,i can't finish listening to this 😥,v1,7,False,False,True,False,False,False,False,False,False,False,emoji_or_punct_only
@lynmoraah,"Such a bad father
I am very upset with him
Wherever he is , I hope he listens to this from his own son",175,https://www.youtube.com/watch?v=BCDdf4fSpYg,0,Undoing My Father’s Damage - Onyango Otieno (Rix poet),comment,,0,Youtube- Undoing my Father's damage.xlsx,comment,"Such a bad father
I am very upset with him
Wherever he is , I hope he listens to this from his own son","such a bad father i am very upset with him wherever he is , i hope he listens to this from his own son",v1,23,True,False,True,False,False,False,False,False,False,False,emoji_or_punct_only
@roseoketch2740,May God bless you all.,175,https://www.youtube.com/watch?v=BCDdf4fSpYg,0,Undoing My Father’s Damage - Onyango Otieno (Rix poet),comment,,0,Youtube- Undoing my Father's damage.xlsx,comment,May God bless you all.,may god bless you all.,v1,5,False,False,False,False,False,False,False,False,False,False,emoji_or_punct_only
@rebeccahwanjiru4393,"Thanks for sharing your story. I can totally relate. Still dealing with childhood trauma, sometimes it feels like i have forgotten but the truth is that my memory has locked those occurrences somewhere so far as a way to protect me from the pain of the past. One day at a time.",175,https://www.youtube.com/watch?v=BCDdf4fSpYg,0,Undoing My Father’s Damage - Onyango Otieno (Rix poet),comment,,4,Youtube- Undoing my Father's damage.xlsx,comment,"Thanks for sharing your story. I can totally relate. Still dealing with childhood trauma, sometimes it feels like i have forgotten but the truth is that my memory has locked those occurrences somewhere so far as a way to protect me from the pain of the past. One day at a time.","thanks for sharing your story. i can totally relate. still dealing with childhood trauma, sometimes it feels like i have forgotten but the truth is that my memory has locked those occurrences somewhere so far as a way to protect me from the pain of the past. one day at a time.",v1,52,False,False,True,False,False,False,True,False,False,False,emoji_or_punct_only
@SueLyons1,"06:57 'I was accustomed to being beaten up' 😔
08:23 'People were so used to screams in my house' 😔
10:27 'What I do know is I couldn't walk for two weeks'  😞
13:14 'I grew up in so much silence' 😔 
19:04 'There's just a tiredness to life' 😔 
I am so sorry for your ten year old experience and the mental health challenges it brought into your life

21:32 'I was loved' ❤
22:47 'The more I spoke up... the more I related to others... 23:04 our upbringing, our socialisation, we are told, toughen it up... we are not meant to bottle it up; we are meant to talk 23:38 we are meant to love; we are meant to express ourselves' 23:58 'so many of us are living with so much shame that we didn't cause ourselves... so that we are ashamed to really live in our truth'
'No matter how much the affliction you've been through as a person, as a community, as a family, 24:36 you are willing, if you want, to get better: it's possible... your trauma does not have to define you; I am defined by love' ❤
Such a beautiful, hopeful, peaceful end. May you continue in peace.",175,https://www.youtube.com/watch?v=BCDdf4fSpYg,0,Undoing My Father’s Damage - Onyango Otieno (Rix poet),comment,,14,Youtube- Undoing my Father's damage.xlsx,comment,"06:57 'I was accustomed to being beaten up' 😔
08:23 'People were so used to screams in my house' 😔
10:27 'What I do know is I couldn't walk for two weeks'  😞
13:14 'I grew up in so much silence' 😔 
19:04 'There's just a tiredness to life' 😔 
I am so sorry for your ten year old experience and the mental health challenges it brought into your life

21:32 'I was loved' ❤
22:47 'The more I spoke up... the more I related to others... 23:04 our upbringing, our socialisation, we are told, toughen it up... we are not meant to bottle it up; we are meant to talk 23:38 we are meant to love; we are meant to express ourselves' 23:58 'so many of us are living with so much shame that we didn't cause ourselves... so that we are ashamed to really live in our truth'
'No matter how much the affliction you've been through as a person, as a community, as a family, 24:36 you are willing, if you want, to get better: it's possible... your trauma does not have to define you; I am defined by love' ❤
Such a beautiful, hopeful, peaceful end. May you continue in peace.","06:57 'i was accustomed to being beaten up' 😔 08:23 'people were so used to screams in my house' 😔 10:27 'what i do know is i couldn't walk for two weeks' 😞 13:14 'i grew up in so much silence' 😔 19:04 'there's just a tiredness to life' 😔 i am so sorry for your ten year old experience and the mental health challenges it brought into your life 21:32 'i was loved' ❤ 22:47 'the more i spoke up... the more i related to others... 23:04 our upbringing, our socialisation, we are told, toughen it up... we are not meant to bottle it up; we are meant to talk 23:38 we are meant to love; we are meant to express ourselves' 23:58 'so many of us are living with so much shame that we didn't cause ourselves... so that we are ashamed to really live in our truth' 'no matter how much the affliction you've been through as a person, as a community, as a family, 24:36 you are willing, if you want, to get better: it's possible... your trauma does not have to define you; i am defined by love' ❤ such a beautiful, hopeful, peaceful end. may you continue in peace.",v1,214,True,True,True,False,False,False,False,False,False,False,emoji_or_punct_only
@chriskelvink9512,I went through a similar case my mum rushed to check where she kept her purse and missed it and thought I had stolen her cash she beat the hell out of me and at some point went for a panga I escaped through the window. I was only 15 in class eight. it still haunts me because i was innocent.,175,https://www.youtube.com/watch?v=BCDdf4fSpYg,3,Undoing My Father’s Damage - Onyango Otieno (Rix poet),comment,,0,Youtube- Undoing my Father's damage.xlsx,comment,I went through a similar case my mum rushed to check where she kept her purse and missed it and thought I had stolen her cash she beat the hell out of me and at some point went for a panga I escaped through the window. I was only 15 in class eight. it still haunts me because i was innocent.,i went through a similar case my mum rushed to check where she kept her purse and missed it and thought i had stolen her cash she beat the hell out of me and at some point went for a panga i escaped through the window. i was only 15 in class eight. it still haunts me because i was innocent.,v1,61,False,False,True,False,False,False,False,True,False,False,emoji_or_punct_only
@dalidzucheredi2495,I'm not sure I can listen to the end,175,https://www.youtube.com/watch?v=BCDdf4fSpYg,0,Undoing My Father’s Damage - Onyango Otieno (Rix poet),comment,,0,Youtube- Undoing my Father's damage.xlsx,comment,I'm not sure I can listen to the end,i'm not sure i can listen to the end,v1,10,False,False,True,False,False,False,False,False,False,False,emoji_or_punct_only
@lehanLovega8326,👏🏾👏🏾👏🏾👏🏾!,175,https://www.youtube.com/watch?v=BCDdf4fSpYg,0,Undoing My Father’s Damage - Onyango Otieno (Rix poet),comment,,0,Youtube- Undoing my Father's damage.xlsx,comment,👏🏾👏🏾👏🏾👏🏾!,👏🏾👏🏾👏🏾👏🏾!,v1,0,False,False,False,False,False,False,False,False,False,False,emoji_or_punct_only
@austheticstudios9295,"Am a poet, almost same story like mine. Poem is the only place i feel heard at the same time relieved. It is a different world away from the natural one. Where I ride a lion and sleep peacefully with snakes. You know👌🏽",175,https://www.youtube.com/watch?v=BCDdf4fSpYg,0,Undoing My Father’s Damage - Onyango Otieno (Rix poet),comment,,2,Youtube- Undoing my Father's damage.xlsx,comment,"Am a poet, almost same story like mine. Poem is the only place i feel heard at the same time relieved. It is a different world away from the natural one. Where I ride a lion and sleep peacefully with snakes. You know👌🏽","am a poet, almost same story like mine. poem is the only place i feel heard at the same time relieved. it is a different world away from the natural one. where i ride a lion and sleep peacefully with snakes. you know👌🏽",v1,43,False,False,True,False,False,False,False,False,False,False,emoji_or_punct_only
@phoebekardita3469,"Maaahn 🔥🔥you are so brave,
Some of us still have traumas caused by our parents,we still carry the luggage around,not knowing how to drop it cause some traumas feel spiritual 🤞....
But at the end of the day we have to find peace and if we won't we'll have to create it.",175,https://www.youtube.com/watch?v=BCDdf4fSpYg,0,Undoing My Father’s Damage - Onyango Otieno (Rix poet),comment,,2,Youtube- Undoing my Father's damage.xlsx,comment,"Maaahn 🔥🔥you are so brave,
Some of us still have traumas caused by our parents,we still carry the luggage around,not knowing how to drop it cause some traumas feel spiritual 🤞....
But at the end of the day we have to find peace and if we won't we'll have to create it.","maaahn 🔥🔥you are so brave, some of us still have traumas caused by our parents,we still carry the luggage around,not knowing how to drop it cause some traumas feel spiritual 🤞.... but at the end of the day we have to find peace and if we won't we'll have to create it.",v1,55,False,False,True,False,False,False,False,False,False,False,emoji_or_punct_only
@Zee_CA,This soo traumatic and ruthless for a  10yr old kid. Sad.,175,https://www.youtube.com/watch?v=BCDdf4fSpYg,0,Undoing My Father’s Damage - Onyango Otieno (Rix poet),comment,,0,Youtube- Undoing my Father's damage.xlsx,comment,This soo traumatic and ruthless for a  10yr old kid. Sad.,this soo traumatic and ruthless for a 10yr old kid. sad.,v1,11,False,False,True,False,False,False,False,False,False,False,emoji_or_punct_only
@freeasabirdtabutany,So sorry for all you went through. What a monster dad,175,https://www.youtube.com/watch?v=BCDdf4fSpYg,0,Undoing My Father’s Damage - Onyango Otieno (Rix poet),comment,,0,Youtube- Undoing my Father's damage.xlsx,comment,So sorry for all you went through. What a monster dad,so sorry for all you went through. what a monster dad,v1,11,False,False,False,False,False,False,False,False,False,False,emoji_or_punct_only
@janettewatila9854,I am so sorry....... Oh  so so tragic..... Parents really damage children.....,175,https://www.youtube.com/watch?v=BCDdf4fSpYg,0,Undoing My Father’s Damage - Onyango Otieno (Rix poet),comment,,2,Youtube- Undoing my Father's damage.xlsx,comment,I am so sorry....... Oh  so so tragic..... Parents really damage children.....,i am so sorry....... oh so so tragic..... parents really damage children.....,v1,12,False,False,True,False,False,False,False,False,False,False,emoji_or_punct_only
@wanjamuchiri132,"""I am hear because I clearly survived"" 
Oooh dear you grew in what you went through😌
Thanks to the power of healing.
I am sending you all the love ❤️",175,https://www.youtube.com/watch?v=BCDdf4fSpYg,0,Undoing My Father’s Damage - Onyango Otieno (Rix poet),comment,,3,Youtube- Undoing my Father's damage.xlsx,comment,"""I am hear because I clearly survived"" 
Oooh dear you grew in what you went through😌
Thanks to the power of healing.
I am sending you all the love ❤️","""i am hear because i clearly survived"" oooh dear you grew in what you went through😌 thanks to the power of healing. i am sending you all the love ❤️",v1,29,False,False,True,False,False,False,False,True,False,False,emoji_or_punct_only
@leilajoan9989,"Thanks for sharing.
This takes alot of courage to speak  of.",175,https://www.youtube.com/watch?v=BCDdf4fSpYg,0,Undoing My Father’s Damage - Onyango Otieno (Rix poet),comment,,0,Youtube- Undoing my Father's damage.xlsx,comment,"Thanks for sharing.
This takes alot of courage to speak  of.",thanks for sharing. this takes alot of courage to speak of.,v1,11,False,False,True,False,False,False,False,False,False,False,emoji_or_punct_only
@idawairimu7093,Waaa I don't like that crude child abuse seemingly discipline.. Really destroys self esteem.. So sorry,175,https://www.youtube.com/watch?v=BCDdf4fSpYg,0,Undoing My Father’s Damage - Onyango Otieno (Rix poet),comment,,0,Youtube- Undoing my Father's damage.xlsx,comment,Waaa I don't like that crude child abuse seemingly discipline.. Really destroys self esteem.. So sorry,waaa i don't like that crude child abuse seemingly discipline.. really destroys self esteem.. so sorry,v1,17,False,False,True,False,False,False,False,False,False,False,emoji_or_punct_only
@mirriammututo8869,A story well told. I am so glad that God preserved you,175,https://www.youtube.com/watch?v=BCDdf4fSpYg,0,Undoing My Father’s Damage - Onyango Otieno (Rix poet),comment,,0,Youtube- Undoing my Father's damage.xlsx,comment,A story well told. I am so glad that God preserved you,a story well told. i am so glad that god preserved you,v1,12,False,False,True,False,False,False,False,False,False,False,emoji_or_punct_only
@jayniemoses8096,This is deep!!,175,https://www.youtube.com/watch?v=BCDdf4fSpYg,0,Undoing My Father’s Damage - Onyango Otieno (Rix poet),comment,,0,Youtube- Undoing my Father's damage.xlsx,comment,This is deep!!,this is deep!!,v1,3,False,False,True,False,False,False,False,False,False,False,emoji_or_punct_only
@charlottesanaipei893,Thank you so much for sharing so proud of you,175,https://www.youtube.com/watch?v=BCDdf4fSpYg,0,Undoing My Father’s Damage - Onyango Otieno (Rix poet),comment,,0,Youtube- Undoing my Father's damage.xlsx,comment,Thank you so much for sharing so proud of you,thank you so much for sharing so proud of you,v1,10,False,False,True,False,False,False,False,False,False,True,substantive_v1
@maryann9679,Very deep. You are brave and thank you for touching lives.,175,https://www.youtube.com/watch?v=BCDdf4fSpYg,0,Undoing My Father’s Damage - Onyango Otieno (Rix poet),comment,,1,Youtube- Undoing my Father's damage.xlsx,comment,Very deep. You are brave and thank you for touching lives.,very deep. you are brave and thank you for touching lives.,v1,11,False,False,True,False,False,False,False,False,False,False,emoji_or_punct_only
