id,text,timestamp,ownerUsername,ownerProfilePicUrl,postUrl,comment_text,comment_text_norm,keep,keep_reason
17843679609453059,😢😢 am heartbroken 💔😭 I just saw the documentary 😭 am sad the system has failed busia,2025-04-14T08:48:02.000Z,kariukipenny,https://scontent-sea5-1.cdninstagram.com/v/t51.2885-19/464761693_1228837651523916_6670283442409926942_n.jpg?stp=dst-jpg_e0_s150x150_tt6&_nc_cat=111&ig_cache_key=GF2zsxtMqbQPn10EAB5xA0Bzm5FcbkULAAAB1501500j-ccb7-5&ccb=7-5&_nc_sid=669407&efg=eyJ2ZW5jb2RlX3RhZyI6InByb2ZpbGVfcGljLnd3dy43MTMuQzMifQ%3D%3D&_nc_ohc=BLh2Pd2y5h4Q7kNvwFL-x5A&_nc_oc=Adp4qDmviyTblX4b1REaZz_WIHVfzc0LGq0BBlRoeln1v0imLApCvOWLCnVIglGbZI0&_nc_ad=z-m&_nc_cid=0&_nc_zt=24&_nc_ht=scontent-sea5-1.cdninstagram.com&_nc_ss=7a3ba&oh=00_Af1iM0AB56dYQ7HGsUoal-a2rohwKyFCGgEwUprvAU_9NA&oe=69DA6543,https://www.instagram.com/p/DG7lceTAQMW/,😢😢 am heartbroken 💔😭 I just saw the documentary 😭 am sad the system has failed busia,😢😢 am heartbroken 💔😭 I just saw the documentary 😭 am sad the system has failed busia,True,piece_relevant
18074725288772780,i had goosebumps watching this😢😢😢,2025-03-26T11:33:25.000Z,ntelenkenvictoria,https://scontent-sea5-1.cdninstagram.com/v/t51.82787-19/632158387_18039558155769037_3827319832274313917_n.jpg?stp=dst-jpg_e0_s150x150_tt6&_nc_cat=110&ig_cache_key=GLP4rSXNlMfv4RZAAL2ihAQcXx01bmNDAQAB1501500j-ccb7-5&ccb=7-5&_nc_sid=669407&efg=eyJ2ZW5jb2RlX3RhZyI6InByb2ZpbGVfcGljLnd3dy44NjQuQzMifQ%3D%3D&_nc_ohc=NodhTm4z1OwQ7kNvwFRUue_&_nc_oc=AdqBWuWSSu2GBSu2tTCqOxccjxZPoSUbPsMxyGvzHdUHxDh0DzGnLFIiWK6Tz46XnzI&_nc_ad=z-m&_nc_cid=0&_nc_zt=24&_nc_ht=scontent-sea5-1.cdninstagram.com&_nc_gid=3KzyjOvEhSKW9UZT7Jy9Og&_nc_ss=7a3ba&oh=00_Af07nQKnAoaw2Ols7olf9HQm4-iB6i9h5msKBAVs_icCIw&oe=69DA4702,https://www.instagram.com/p/DG7lceTAQMW/,i had goosebumps watching this😢😢😢,i had goosebumps watching this😢😢😢,True,content_reaction
18283067332300157,"Something that most people don't realize is that what these so called activists are doing is not just raising awareness on issues affecting a women but they're fighting a male child, and i'm telling you they know what they're doing and they're doing it on purpose. The real fight is on male child and a man in general.",2025-03-15T21:40:18.000Z,infinixmobile.tz,https://scontent-sea1-1.cdninstagram.com/v/t51.2885-19/412265666_376390454776821_7029639950042945502_n.jpg?stp=dst-jpg_e0_s150x150_tt6&_nc_cat=101&ig_cache_key=GMKskhj1k1o7U1YBAN5XNDlKTI5hbkULAAAB1501500j-ccb7-5&ccb=7-5&_nc_sid=669407&efg=eyJ2ZW5jb2RlX3RhZyI6InByb2ZpbGVfcGljLnd3dy4xMDc5LkMzIn0%3D&_nc_ohc=hbmOhzHFej0Q7kNvwEJvdqn&_nc_oc=AdoAaxiZ94XAwTh4SCo7awfnLoLbxCZKeyhoOPgwwBgKY2KoHUKhhj1Y_D4DO399NFw&_nc_ad=z-m&_nc_cid=0&_nc_zt=24&_nc_ht=scontent-sea1-1.cdninstagram.com&_nc_ss=7a3ba&oh=00_Af33f7lcOCvZFOlzP7onw91aFPQq45A26kKpg4P02DU5tQ&oe=69DA6BA6,https://www.instagram.com/p/DG7lceTAQMW/,"Something that most people don't realize is that what these so called activists are doing is not just raising awareness on issues affecting a women but they're fighting a male child, and i'm telling you they know what they're doing and they're doing it on purpose. The real fight is on male child and a man in general.","Something that most people don't realize is that what these so called activists are doing is not just raising awareness on issues affecting a women but they're fighting a male child, and i'm telling you they know what they're doing and they're doing it on purpose. The real fight is on male child and a man in general.",True,piece_relevant
18071913481834628,I admire you as a person..and your work is remarkable. Thank You for using your platform to bring change ❤️💐🙏,2025-03-11T21:04:06.000Z,lonah_lett,https://scontent-sea1-1.cdninstagram.com/v/t51.82787-19/620856295_18547995247003892_1899722324831285634_n.jpg?stp=dst-jpg_e0_s150x150_tt6&_nc_cat=106&ig_cache_key=GOeDASX0SP6rTeVBAIKxcqdjK10abmNDAQAB1501500j-ccb7-5&ccb=7-5&_nc_sid=669407&efg=eyJ2ZW5jb2RlX3RhZyI6InByb2ZpbGVfcGljLnd3dy44MDkuQzMifQ%3D%3D&_nc_ohc=XIEgYzCfaXMQ7kNvwEnXIEr&_nc_oc=Adrc5aIARW7fPFWRS5l2qwQrMpC5xtyswH_qo0wgKdPnoVeeDbe7q3CWcHRDO7q-CSk&_nc_ad=z-m&_nc_cid=0&_nc_zt=24&_nc_ht=scontent-sea1-1.cdninstagram.com&_nc_gid=rzJ8t4Eu8lZ97A35J9mxWA&_nc_ss=7a3ba&oh=00_Af0WV0UWDWLG_U5ZYFs8TayaACz4qQff44AWVIFOhCl99w&oe=69DA4E62,https://www.instagram.com/p/DG7lceTAQMW/,I admire you as a person..and your work is remarkable. Thank You for using your platform to bring change ❤️💐🙏,I admire you as a person..and your work is remarkable. Thank You for using your platform to bring change ❤️💐🙏,True,content_reaction
18003104486577587,I wish  this is the time when mzazi yeyote akikupata ukifanya kosa anakupa onyo coz i think mengi ya haya hayangekuwa yanafanyika.,2025-03-10T13:11:23.000Z,patrickngigim,https://scontent-sea5-1.cdninstagram.com/v/t51.2885-19/445782374_469303712211034_7727055976290033085_n.jpg?stp=dst-jpg_e0_s150x150_tt6&_nc_cat=107&ig_cache_key=GGYZkhpa4A5J1KoBAL2dU4J4BDxrbkULAAAB1501500j-ccb7-5&ccb=7-5&_nc_sid=669407&efg=eyJ2ZW5jb2RlX3RhZyI6InByb2ZpbGVfcGljLnd3dy4xMDgwLkMzIn0%3D&_nc_ohc=NwB6x2wm7J8Q7kNvwEODR2G&_nc_oc=AdqYanggWwpBwOW-23DvhgOa1JQUuk2XADUJsj4f7QJSTp3ktOAJNofCbj8VN-YrsSU&_nc_ad=z-m&_nc_cid=0&_nc_zt=24&_nc_ht=scontent-sea5-1.cdninstagram.com&_nc_ss=7a3ba&oh=00_Af2r9YQXKeSDBTl_voI72-1fzWLpT7PI9zqI5mx1fmqSiQ&oe=69DA6C06,https://www.instagram.com/p/DG7lceTAQMW/,I wish  this is the time when mzazi yeyote akikupata ukifanya kosa anakupa onyo coz i think mengi ya haya hayangekuwa yanafanyika.,I wish this is the time when mzazi yeyote akikupata ukifanya kosa anakupa onyo coz i think mengi ya haya hayangekuwa yanafanyika.,True,content_reaction
17949158384947570,🙌🙌 this is so educative,2025-03-10T05:03:20.000Z,magga_ritoh,https://scontent-sea1-1.cdninstagram.com/v/t51.82787-19/653502635_17944368396140334_715014642799156584_n.jpg?stp=dst-jpg_e0_s150x150_tt6&_nc_cat=101&ig_cache_key=GKuo8yYuf-jXTsA-AGgdP4EHPuwJbmNDAQAB1501500j-ccb7-5&ccb=7-5&_nc_sid=669407&efg=eyJ2ZW5jb2RlX3RhZyI6InByb2ZpbGVfcGljLnd3dy4xMDgwLkMzIn0%3D&_nc_ohc=jK1dsMqwhesQ7kNvwFtPJgd&_nc_oc=Adqmay4RXyywl-_xGfJodbKNDvKgnQcMzWSaxhWysflqmWGo3tUu5cGlNGAvLPGHRE4&_nc_ad=z-m&_nc_cid=0&_nc_zt=24&_nc_ht=scontent-sea1-1.cdninstagram.com&_nc_gid=rzJ8t4Eu8lZ97A35J9mxWA&_nc_ss=7a3ba&oh=00_Af2W9NewXlY5wvkQ31FcbF91nrW19RIi9jHXz1_qdTZKAw&oe=69DA75F0,https://www.instagram.com/p/DG7lceTAQMW/,🙌🙌 this is so educative,🙌🙌 this is so educative,True,content_reaction
18471501319067737,I'm from watching this documentary. Phil receive your flowers. 👏,2025-03-09T20:20:09.000Z,pauline__errands,https://scontent-sea5-1.cdninstagram.com/v/t51.82787-19/615797940_17984139698927718_7181258936128199560_n.jpg?stp=dst-jpg_e0_s150x150_tt6&_nc_cat=107&ig_cache_key=GLRUtCRmeFjSeuQ-AIhbBVj09KhjbmNDAQAB1501500j-ccb7-5&ccb=7-5&_nc_sid=669407&efg=eyJ2ZW5jb2RlX3RhZyI6InByb2ZpbGVfcGljLnd3dy44MTAuQzMifQ%3D%3D&_nc_ohc=zP51iDUOIHQQ7kNvwH0TEw-&_nc_oc=AdqGRn0nOTVJ1fBaKZ3uh6ZEDztLjFhlz5mvmQREG4p33_mVUk4wL55tmY1-eqN1nms&_nc_ad=z-m&_nc_cid=0&_nc_zt=24&_nc_ht=scontent-sea5-1.cdninstagram.com&_nc_gid=rzJ8t4Eu8lZ97A35J9mxWA&_nc_ss=7a3ba&oh=00_Af0OMhBhgbvzntyEZvBTZtVyCnlDrzGX8FfFY8-i_l3qZA&oe=69DA5DC7,https://www.instagram.com/p/DG7lceTAQMW/,I'm from watching this documentary. Phil receive your flowers. 👏,I'm from watching this documentary. Phil receive your flowers. 👏,True,piece_relevant
17886434652229208,The conversations that we should be having 😢😢,2025-03-09T10:25:23.000Z,makini_fay,https://scontent-sea1-1.cdninstagram.com/v/t51.82787-19/586834899_18090216710297718_510831003860417231_n.jpg?stp=dst-jpg_e0_s150x150_tt6&_nc_cat=108&ig_cache_key=GNNj_iJ2WO3M9ERAAM86W20X1hYHbmNDAQAB1501500j-ccb7-5&ccb=7-5&_nc_sid=669407&efg=eyJ2ZW5jb2RlX3RhZyI6InByb2ZpbGVfcGljLnd3dy4xMDgwLkMzIn0%3D&_nc_ohc=ZUuO0ZqDl8kQ7kNvwG7AB7R&_nc_oc=AdrrL9ekAaC0iDRiATmNNVnbCXqoFj-iJGhhFBxyMOrbHpEaDM4qYFanJBq_tAH6PQU&_nc_ad=z-m&_nc_cid=0&_nc_zt=24&_nc_ht=scontent-sea1-1.cdninstagram.com&_nc_gid=rzJ8t4Eu8lZ97A35J9mxWA&_nc_ss=7a3ba&oh=00_Af0aGyD0AkxbTIhMH5dVx5NzM3LpA059omiySy1jYJNNDg&oe=69DA74B4,https://www.instagram.com/p/DG7lceTAQMW/,The conversations that we should be having 😢😢,The conversations that we should be having 😢😢,True,piece_relevant
18355254241182733,I love this! 👏 Every aspect of sexual violence and harassment must be fully addressed—nothing should be dismissed as “that’s just a small matter.” Such animosity has no place and must be eradicated.,2025-03-09T08:38:37.000Z,_ms.irungu_,https://scontent-sea5-1.cdninstagram.com/v/t51.82787-19/657571188_18204494104337139_1450102543724656082_n.jpg?stp=dst-jpg_e0_s150x150_tt6&_nc_cat=109&ig_cache_key=GHS9MSfzmmcU5KxAANI1mZ6UzB8UbmNDAQAB1501500j-ccb7-5&ccb=7-5&_nc_sid=669407&efg=eyJ2ZW5jb2RlX3RhZyI6InByb2ZpbGVfcGljLnd3dy4xMDgwLkMzIn0%3D&_nc_ohc=3TsAUPxn6SMQ7kNvwEX1QiL&_nc_oc=AdpFS7rP6ZPCLMm3cMRVNKeHEqa2-wvNpQOObGmCFdXvhXn5L0u_OaqS-URHM-FaUQ4&_nc_ad=z-m&_nc_cid=0&_nc_zt=24&_nc_ht=scontent-sea5-1.cdninstagram.com&_nc_gid=rzJ8t4Eu8lZ97A35J9mxWA&_nc_ss=7a3ba&oh=00_Af2fRpLsbbPcUNFZw6XDcDAw0M1jW_L8acOCNgmWPOIPWA&oe=69DA7E5B,https://www.instagram.com/p/DG7lceTAQMW/,I love this! 👏 Every aspect of sexual violence and harassment must be fully addressed—nothing should be dismissed as “that’s just a small matter.” Such animosity has no place and must be eradicated.,"I love this! 👏 Every aspect of sexual violence and harassment must be fully addressed—nothing should be dismissed as ""that's just a small matter."" Such animosity has no place and must be eradicated.",True,piece_relevant
18018127268675107,"This is a great job, please go as deep as those gvt offices and have them explain why the justice system is f@*d up, our female leaders need to give us answers as to why they are in those positions is they  can't do what is supposed to be done . They are women in leadership because we needed women to represent us there, not to twerk on TikTok...... I wonder why those who give life are the ones to go though such",2025-03-09T06:04:07.000Z,miss_chebet.m,https://scontent-sea1-1.cdninstagram.com/v/t51.2885-19/280156712_3334983770064967_7678299313000417654_n.jpg?stp=dst-jpg_e0_s150x150_tt6&_nc_cat=100&ig_cache_key=GCjashBHSPJqJtkLAHYJhDaLzI5qbkULAAAB1501500j-ccb7-5&ccb=7-5&_nc_sid=669407&efg=eyJ2ZW5jb2RlX3RhZyI6InByb2ZpbGVfcGljLnd3dy40ODAuQzMifQ%3D%3D&_nc_ohc=axh2NOnGumEQ7kNvwHcPWxQ&_nc_oc=AdqN95yYmFF2YDc79mbIZp4yJizIiI1p4FYlGtwKIJgn2zkPS8IqKCKEkEG55DxIXIA&_nc_ad=z-m&_nc_cid=0&_nc_zt=24&_nc_ht=scontent-sea1-1.cdninstagram.com&_nc_ss=7a3ba&oh=00_Af2lQXtWJHgA7lbFmY3o80XeHWnwGNgWD8H1LoO210fl4g&oe=69DA4ED4,https://www.instagram.com/p/DG7lceTAQMW/,"This is a great job, please go as deep as those gvt offices and have them explain why the justice system is f@*d up, our female leaders need to give us answers as to why they are in those positions is they  can't do what is supposed to be done . They are women in leadership because we needed women to represent us there, not to twerk on TikTok...... I wonder why those who give life are the ones to go though such","This is a great job, please go as deep as those gvt offices and have them explain why the justice system is f@*d up, our female leaders need to give us answers as to why they are in those positions is they can't do what is supposed to be done . They are women in leadership because we needed women to represent us there, not to twerk on TikTok...... I wonder why those who give life are the ones to go though such",True,piece_relevant
17876444640274397,Finally we found someone to help us know what's going on 😍😍😍😍😍good job,2025-03-09T05:21:09.000Z,mama_avianna,https://scontent-sea5-1.cdninstagram.com/v/t51.82787-19/611732234_18342413698228188_2413888746840824911_n.jpg?stp=dst-jpg_e0_s150x150_tt6&_nc_cat=109&ig_cache_key=GApLdiTcX878UypBAE_cwqIG238hbmNDAQAB1501500j-ccb7-5&ccb=7-5&_nc_sid=669407&efg=eyJ2ZW5jb2RlX3RhZyI6InByb2ZpbGVfcGljLnd3dy43MjAuQzMifQ%3D%3D&_nc_ohc=j6VveNmktowQ7kNvwFkpjno&_nc_oc=AdqhMXO9cf3-V9NVorWeqMCZ8IbSszghrWG5-C76y4G0Hym9pDbJYccYKayZgmRLSvU&_nc_ad=z-m&_nc_cid=0&_nc_zt=24&_nc_ht=scontent-sea5-1.cdninstagram.com&_nc_gid=rzJ8t4Eu8lZ97A35J9mxWA&_nc_ss=7a3ba&oh=00_Af325P6ROSXyeY8-gTQ9A4RadNrReDrdvuwRBJcAYeYk4w&oe=69DA72EB,https://www.instagram.com/p/DG7lceTAQMW/,Finally we found someone to help us know what's going on 😍😍😍😍😍good job,Finally we found someone to help us know what's going on 😍😍😍😍😍good job,True,content_reaction
17996442056610338,"This is how you transform the world, by Centering the stories of the oppressed one conversation at a time. We must do better as a country. Thank you Phil for using your voice to champion change",2025-03-09T00:36:52.000Z,mumbiwayesu,https://scontent-sea1-1.cdninstagram.com/v/t51.2885-19/45597876_2279898245577330_1784230436684169216_n.jpg?stp=dst-jpg_e0_s150x150_tt6&_nc_cat=101&ig_cache_key=GLTEtwJyOg0tjhkIAAAAAAAh3MIYbkULAAAB1501500j-ccb7-5&ccb=7-5&_nc_sid=669407&efg=eyJ2ZW5jb2RlX3RhZyI6InByb2ZpbGVfcGljLnd3dy42NDAuQzMifQ%3D%3D&_nc_ohc=KIDVAkLIy8QQ7kNvwEXcbBG&_nc_oc=Adr_PEGKzXJ1cpuoFW1xo4h24oNPGDOHA_48PW7Dm2-ivYqU50WLxiRKbSUy2sbNkiQ&_nc_ad=z-m&_nc_cid=0&_nc_zt=24&_nc_ht=scontent-sea1-1.cdninstagram.com&_nc_ss=7a3ba&oh=00_Af3Cw3cWIb85mrZiqAzA_Vajdjkr_6wT7hqkvBfX9OEOrQ&oe=69DA62FC,https://www.instagram.com/p/DG7lceTAQMW/,"This is how you transform the world, by Centering the stories of the oppressed one conversation at a time. We must do better as a country. Thank you Phil for using your voice to champion change","This is how you transform the world, by Centering the stories of the oppressed one conversation at a time. We must do better as a country. Thank you Phil for using your voice to champion change",True,piece_relevant
18024413600404442,Very touching and educative,2025-03-08T22:49:59.000Z,paulas_beautyhaven,https://scontent-sea1-1.cdninstagram.com/v/t51.82787-19/515482115_17874252351374391_2471938707571726773_n.jpg?stp=dst-jpg_e0_s150x150_tt6&_nc_cat=100&ig_cache_key=GAOiuR43hAeuiYA-ALXZWVsoF04ibmNDAQAB1501500j-ccb7-5&ccb=7-5&_nc_sid=669407&efg=eyJ2ZW5jb2RlX3RhZyI6InByb2ZpbGVfcGljLnd3dy4xMDgwLkMzIn0%3D&_nc_ohc=xA1jX6IaRgwQ7kNvwH4VGpp&_nc_oc=AdowuAe0t8XglagHsrCrLzr7cBkC0u3HZhgZO20dwhd2-L6DSLIHT0K1HTxmwLgtMuM&_nc_ad=z-m&_nc_cid=0&_nc_zt=24&_nc_ht=scontent-sea1-1.cdninstagram.com&_nc_gid=rzJ8t4Eu8lZ97A35J9mxWA&_nc_ss=7a3ba&oh=00_Af0rWqGtCDAuIffszVgRi7Wxv1dcKWuLc2yyUmJ3HvQPNg&oe=69DA561A,https://www.instagram.com/p/DG7lceTAQMW/,Very touching and educative,Very touching and educative,True,emotive_reaction
18037703894445025,"@phil_director in the words of Oprah Winfrey, ""all our talents and gifts must have an angle of service to humanity, sth bigger than us, than profit and fame"", and this is exactly it man. Much Respect Brother.",2025-03-08T20:22:56.000Z,karis_wangeci,https://scontent-sea1-1.cdninstagram.com/v/t51.82787-19/539325470_18519213166028964_6658517216938842328_n.jpg?stp=dst-jpg_e0_s150x150_tt6&_nc_cat=106&ig_cache_key=GB50JSCk6EdSIMtBANhYdmYhzmdcbmNDAQAB1501500j-ccb7-5&ccb=7-5&_nc_sid=669407&efg=eyJ2ZW5jb2RlX3RhZyI6InByb2ZpbGVfcGljLnd3dy4xMDgwLkMzIn0%3D&_nc_ohc=164gqKskyEAQ7kNvwExzP7p&_nc_oc=AdpqtY-i4YhLt6D4c_D5sy82A2YGhbSJ5VOUWbcaoSyZIsEZ46kJTyKFBuvN1I1uLV8&_nc_ad=z-m&_nc_cid=0&_nc_zt=24&_nc_ht=scontent-sea1-1.cdninstagram.com&_nc_gid=rzJ8t4Eu8lZ97A35J9mxWA&_nc_ss=7a3ba&oh=00_Af1NKYnfBmiZXAwZYZek2zGf3KvxViDh7VSn_7lpAiadbw&oe=69DA7704,https://www.instagram.com/p/DG7lceTAQMW/,"@phil_director in the words of Oprah Winfrey, ""all our talents and gifts must have an angle of service to humanity, sth bigger than us, than profit and fame"", and this is exactly it man. Much Respect Brother.","@phil_director in the words of Oprah Winfrey, ""all our talents and gifts must have an angle of service to humanity, sth bigger than us, than profit and fame"", and this is exactly it man. Much Respect Brother.",True,piece_relevant
17885119269233942,"Phil, Have your flowers 💐🙌Thank you for having this conversation.",2025-03-08T18:03:49.000Z,pa.tience_w,https://scontent-sea5-1.cdninstagram.com/v/t51.82787-19/632245524_18032414078783832_5910345977605554777_n.jpg?stp=dst-jpg_e0_s150x150_tt6&_nc_cat=107&ig_cache_key=GBRNryVY0ZuTYhBAAFmC1i5axAVSbmNDAQAB1501500j-ccb7-5&ccb=7-5&_nc_sid=669407&efg=eyJ2ZW5jb2RlX3RhZyI6InByb2ZpbGVfcGljLnd3dy4xMDgwLkMzIn0%3D&_nc_ohc=z67pRnQjjVUQ7kNvwFTigGT&_nc_oc=AdqB8USI0dGzrf2oFgqyIhtnMrRd-Afl5OZzOeHcmRpJwUdhquJmrT3Fl1opE4sBPLo&_nc_ad=z-m&_nc_cid=0&_nc_zt=24&_nc_ht=scontent-sea5-1.cdninstagram.com&_nc_gid=zKxEf0KF8LjNto6M_jv-kg&_nc_ss=7a3ba&oh=00_Af30psvCVAE7R03FCSw9QOuWjLX0mH-bYEO_j2lMZJbNuw&oe=69DA5C61,https://www.instagram.com/p/DG7lceTAQMW/,"Phil, Have your flowers 💐🙌Thank you for having this conversation.","Phil, Have your flowers 💐🙌Thank you for having this conversation.",True,piece_relevant
18073414942772923,"As a rape victim ,I felt this one and you did good. Let's continue having these conversations. This is a good start. Getting solutions ❤️🔥",2025-03-08T17:34:52.000Z,_wanjirumuturi_,https://scontent-sea5-1.cdninstagram.com/v/t51.82787-19/587946269_18527433160067558_5731781812012040183_n.jpg?stp=dst-jpg_e0_s150x150_tt6&_nc_cat=102&ig_cache_key=GB1ZCyPmCRswmtJBAPe-BZMwYYtPbmNDAQAB1501500j-ccb7-5&ccb=7-5&_nc_sid=669407&efg=eyJ2ZW5jb2RlX3RhZyI6InByb2ZpbGVfcGljLnd3dy4xMDgwLkMzIn0%3D&_nc_ohc=RjIXRA9ZQi4Q7kNvwF2VuWe&_nc_oc=AdotoIR5VSAmQKryY6kS_l1X7yJt2FD1JQ73VOrhWLCdg5bovXvzwz7JCzHH4wX4Lv0&_nc_ad=z-m&_nc_cid=0&_nc_zt=24&_nc_ht=scontent-sea5-1.cdninstagram.com&_nc_gid=zKxEf0KF8LjNto6M_jv-kg&_nc_ss=7a3ba&oh=00_Af04SwZqh2dmPPoOT0oEGYBaGNI6Mufnkuxy0WWTEnM6Bw&oe=69DA540B,https://www.instagram.com/p/DG7lceTAQMW/,"As a rape victim ,I felt this one and you did good. Let's continue having these conversations. This is a good start. Getting solutions ❤️🔥","As a rape victim ,I felt this one and you did good. Let's continue having these conversations. This is a good start. Getting solutions ❤️🔥",True,piece_relevant
18026994800368470,"Ngai i'm shocked 😯, thank you Phil for this insight",2025-03-08T17:34:04.000Z,alicewgitau,https://scontent-sea1-1.cdninstagram.com/v/t51.2885-19/394651092_672629474837720_6975576741709788413_n.jpg?stp=dst-jpg_e0_s150x150_tt6&_nc_cat=108&ig_cache_key=GNTlhRfYxOnAwGMCAP20FqEWOs5gbkULAAAB1501500j-ccb7-5&ccb=7-5&_nc_sid=669407&efg=eyJ2ZW5jb2RlX3RhZyI6InByb2ZpbGVfcGljLnd3dy4xMDgwLkMzIn0%3D&_nc_ohc=4hXVG3gIJZ0Q7kNvwGXrcbH&_nc_oc=Ado0Y2emDXJhzxzOee1QgxXAJmPOTQ_iEiC-C1coO7MWomLl9Mzx8lE8LkSmcp5LQIc&_nc_ad=z-m&_nc_cid=0&_nc_zt=24&_nc_ht=scontent-sea1-1.cdninstagram.com&_nc_ss=7a3ba&oh=00_Af2XQqzdbu9NAmSmoIuwjRaJS7bJXMI6b9KHqJVYR6pLJw&oe=69DA5C40,https://www.instagram.com/p/DG7lceTAQMW/,"Ngai i'm shocked 😯, thank you Phil for this insight","Ngai i'm shocked 😯, thank you Phil for this insight",True,piece_relevant
17882631405147907,"👏👏👏as person who has walked a journey with those who were raped, I can tell you it's not easy, I used to have sleepless nights, most of the victims contracted HIV, others gave birth to kids who  were HIV +
It's a less y'all",2025-03-08T16:34:22.000Z,christyanyango,https://scontent-sea5-1.cdninstagram.com/v/t51.82787-19/607580714_18091337171295121_1801932654381843196_n.jpg?stp=dst-jpg_e0_s150x150_tt6&_nc_cat=103&ig_cache_key=GCryNiSRW5ut_UVAAPxCm70zwAEZbmNDAQAB1501500j-ccb7-5&ccb=7-5&_nc_sid=669407&efg=eyJ2ZW5jb2RlX3RhZyI6InByb2ZpbGVfcGljLnd3dy4xMDgwLkMzIn0%3D&_nc_ohc=ult9gvw7arMQ7kNvwGxs8MD&_nc_oc=Ado4MKUiQIxomfJ4KYZ_2mdcQuIsf4bIVP0upS-7cDAsbLyPV_uD7rWADgInlx4Ssy0&_nc_ad=z-m&_nc_cid=0&_nc_zt=24&_nc_ht=scontent-sea5-1.cdninstagram.com&_nc_gid=zKxEf0KF8LjNto6M_jv-kg&_nc_ss=7a3ba&oh=00_Af1bWEKCf1epxYwy70C3zpiAmvoUErhmqlvEsWzl0kzl_g&oe=69DA5837,https://www.instagram.com/p/DG7lceTAQMW/,"👏👏👏as person who has walked a journey with those who were raped, I can tell you it's not easy, I used to have sleepless nights, most of the victims contracted HIV, others gave birth to kids who  were HIV +
It's a less y'all","👏👏👏as person who has walked a journey with those who were raped, I can tell you it's not easy, I used to have sleepless nights, most of the victims contracted HIV, others gave birth to kids who were HIV + It's a less y'all",True,piece_relevant
18036491879217577,Watching this for the little 9 year old girl who I met at work sexually abused but the mother hid the perpetrator. Il watch this for her. I still think about her,2025-03-08T16:14:40.000Z,moigesh,https://scontent-sea5-1.cdninstagram.com/v/t51.82787-19/629252942_18560663254045813_8537657740047940825_n.jpg?stp=dst-jpg_e0_s150x150_tt6&_nc_cat=103&ig_cache_key=GE6jgSV1lA0s0-BBANn8a_l62nt2bmNDAQAB1501500j-ccb7-5&ccb=7-5&_nc_sid=669407&efg=eyJ2ZW5jb2RlX3RhZyI6InByb2ZpbGVfcGljLnd3dy4xMDI0LkMzIn0%3D&_nc_ohc=lR1aUKQdU64Q7kNvwFT4MDa&_nc_oc=AdraI0MtIG1HDwcaceg8ouGzJH_pbxy4BhFDVa4Nrt72IFDrBcymF8-KaIBszW7sYFE&_nc_ad=z-m&_nc_cid=0&_nc_zt=24&_nc_ht=scontent-sea5-1.cdninstagram.com&_nc_gid=zKxEf0KF8LjNto6M_jv-kg&_nc_ss=7a3ba&oh=00_Af2Xqd8bSk7YnlJBv1HDI0sVFfsQa5Q-lgiczvV0yrnq4w&oe=69DA783D,https://www.instagram.com/p/DG7lceTAQMW/,Watching this for the little 9 year old girl who I met at work sexually abused but the mother hid the perpetrator. Il watch this for her. I still think about her,Watching this for the little 9 year old girl who I met at work sexually abused but the mother hid the perpetrator. Il watch this for her. I still think about her,True,content_reaction
18087947635580504,This was painful to watch but these stories must be told. Thank you Phil .,2025-03-08T15:29:47.000Z,joey_nish1,https://scontent-sea5-1.cdninstagram.com/v/t51.2885-19/359756348_947966589652769_3260666087284211561_n.jpg?stp=dst-jpg_e0_s150x150_tt6&_nc_cat=109&ig_cache_key=GDxycRUhz9WrK14DAGn-vNeHNkAtbkULAAAB1501500j-ccb7-5&ccb=7-5&_nc_sid=669407&efg=eyJ2ZW5jb2RlX3RhZyI6InByb2ZpbGVfcGljLnd3dy4xMDgwLkMzIn0%3D&_nc_ohc=B8xIHeZTWJcQ7kNvwEzB0xG&_nc_oc=AdqtluR-fPu6fxv3LmtDx8FAHTAPl0XioqOafLyoRjS5KDWuTFUnadkMn2juFBDakyI&_nc_ad=z-m&_nc_cid=0&_nc_zt=24&_nc_ht=scontent-sea5-1.cdninstagram.com&_nc_ss=7a3ba&oh=00_Af3gBLpsXzf1fjEiZ3SeIc7PZMGvyt33j6q4nlEKCfSmhA&oe=69DA5757,https://www.instagram.com/p/DG7lceTAQMW/,This was painful to watch but these stories must be told. Thank you Phil .,This was painful to watch but these stories must be told. Thank you Phil .,True,piece_relevant
18067729138810252,Thank you so so much for this 🥺💔💔💔. We thank you kwa kupaza sauti for all the victims who’ve been silenced 💔 and for all women at large 🥺. This is gut-wrenching💔. #endfemicideke,2025-03-08T14:04:20.000Z,nataliekeyyy,https://scontent-sea1-1.cdninstagram.com/v/t51.82787-19/627045346_18085668818166223_1778038055871756838_n.jpg?stp=dst-jpg_e0_s150x150_tt6&_nc_cat=108&ig_cache_key=GOLzXyXPoW7p0UBAACa6XP0w3KwYbmNDAQAB1501500j-ccb7-5&ccb=7-5&_nc_sid=669407&efg=eyJ2ZW5jb2RlX3RhZyI6InByb2ZpbGVfcGljLnd3dy44MzEuQzMifQ%3D%3D&_nc_ohc=EhO278n4NeUQ7kNvwGNgBC4&_nc_oc=AdrJlGtLM00nhH45CR30hr5UCUzvTX5HZPdoVQ9eN1j8To04CSrS3BUr5vadCAmhSIY&_nc_ad=z-m&_nc_cid=0&_nc_zt=24&_nc_ht=scontent-sea1-1.cdninstagram.com&_nc_gid=zKxEf0KF8LjNto6M_jv-kg&_nc_ss=7a3ba&oh=00_Af2GniSfpCzuiHxY8Mx7sHA3M78oTrEygxvUupM4n26A5A&oe=69DA47A1,https://www.instagram.com/p/DG7lceTAQMW/,Thank you so so much for this 🥺💔💔💔. We thank you kwa kupaza sauti for all the victims who’ve been silenced 💔 and for all women at large 🥺. This is gut-wrenching💔. #endfemicideke,Thank you so so much for this 🥺💔💔💔. We thank you kwa kupaza sauti for all the victims who've been silenced 💔 and for all women at large 🥺. This is gut-wrenching💔. #endfemicideke,True,piece_relevant
18060141467012123,😭😭😭😭😭.... 💔 💔 💔 !!! I'm ANGRY! May God help me to forgive because every time I see yet another story of a defiled kid... It ..it..it... 😭 😭! I honestly feel like shooting down or burning the heartless person putting the kid through a lifetime of emotional damage if they survive the act. I'm ANGRY!,2025-03-08T13:26:58.000Z,bire_ge,https://scontent-sea1-1.cdninstagram.com/v/t51.89012-19/573323465_1219825463302212_7278921664109726296_n.png?stp=dst-webp_s150x150&_nc_cat=1&ig_cache_key=YW5vbnltb3VzX3Byb2ZpbGVfcGlj.3-ccb7-5&ccb=7-5&_nc_sid=669407&efg=eyJ2ZW5jb2RlX3RhZyI6InByb2ZpbGVfcGljLnd3dy5DMyJ9&_nc_ohc=UsKLEFO1RaIQ7kNvwFZVS-q&_nc_oc=Adqj298ePbalzWmwvF_qzTm5v0s9BAXKmpMWkX4pzon2AS8AdANknxoplsFoFbFAODA&_nc_ad=z-m&_nc_cid=0&_nc_zt=24&_nc_ht=scontent-sea1-1.cdninstagram.com&_nc_gid=8cSr3jqPQWtcqevM1AdjbA&_nc_ss=7a3ba&oh=00_Af3oKeksCpO5XEd8RQzCvUxv8KCyhKaWHGeMplcj3kS1Cg&oe=69DA5199,https://www.instagram.com/p/DG7lceTAQMW/,😭😭😭😭😭.... 💔 💔 💔 !!! I'm ANGRY! May God help me to forgive because every time I see yet another story of a defiled kid... It ..it..it... 😭 😭! I honestly feel like shooting down or burning the heartless person putting the kid through a lifetime of emotional damage if they survive the act. I'm ANGRY!,😭😭😭😭😭.... 💔 💔 💔 !!! I'm ANGRY! May God help me to forgive because every time I see yet another story of a defiled kid... It ..it..it... 😭 😭! I honestly feel like shooting down or burning the heartless person putting the kid through a lifetime of emotional damage if they survive the act. I'm ANGRY!,True,piece_relevant
